{
  "schema_version": "0.1.0",
  "sha256": "6ae7186e8e261b769263d35956609ace40e6216e197d18b3e2e34acd3b1f7bfd",
  "bytes": 43,
  "mime": "application/json",
  "source_id": "D05",
  "collection": "1950 Census (National Archives)",
  "locator": {
    "kind": "url",
    "value": "https://1950census.archives.gov/api/search?name=Davidson&state=NY&county=Nassau&ed=30-393&page=1"
  },
  "retrieved_at": "2026-10-03T00:06:37Z",
  "retrieved_by": "agent:harness-real-data for user:neural",
  "http": {
    "status": 200,
    "etag": null,
    "last_modified": "Sat, 03 Oct 2026 00:06:37 GMT",
    "final_url": "https://1950census.archives.gov/api/search?name=Davidson&state=NY&county=Nassau&ed=30-393&page=1",
    "content_type": "application/json"
  },
  "rights": {
    "terms": "Public domain",
    "redistributable": false,
    "cost": "free"
  },
  "trust_tier": "T1",
  "pages": 1,
  "notes": "{\"captured\":\"one request by the harness's author on 3 October 2026 00:06 UTC (2 October local), the 1950 census site's own search for Davidson in Nassau County, New York, within enumeration district 30-393, the district beside 30-392 where the Davidson household is: the site's empty answer\",\"connector\":\"nara_1950\"}"
}
